{
  "$schema": "https://schemas.arusty.dev/markdown/frontmatter/v1.0.0.schema.json",
  "title": "Rust Library Template",
  "id": "a1b2c3d4-e5f6-4a7b-8c9d-0e1f2a3b4c5d",
  "description": "Base configuration for Rust library projects",
  "version": "1.0.0",
  "status": "âœ… Published",
  "tags": ["lang", "rust", "lib"],
  "authors": [
    "John Doe <jdoe@example.com>",
    "Claude Opus 4.5 <feedback@anthropic.com>"
  ],
  "related": [
    "b2c3d4e5-f6a7-4b8c-9d0e-1f2a3b4c5d6e",
    "c3d4e5f6-a7b8-4c9d-0e1f-2a3b4c5d6e7f@d4e5f6a7-b8c9-4d0e-1f2a-3b4c5d6e7f8a",
    "https://docs.example.com/rust/library-guide"
  ],
  "lastUpdated": "2025-12-20T10:30:00Z",
  "draft": false,
  "type": "template",
  "license": "MIT"
}
